{
  "schema_version": 1,
  "serial": "TI-20260822-001",
  "generated": "2026-08-31T21:47:32Z",
  "capture_is_retrospective": true,
  "entries": [
    {
      "source_id": "SRC-0019",
      "ref": "REF-001",
      "url": "https://thehackernews.com/2026/08/sandworm-linked-uac-0145-uses-fake-job.html",
      "format_family": "html",
      "preservation": "none",
      "fetched": "2026-08-31T21:45:47Z",
      "http_status": 200,
      "content_type": "text/html",
      "content_length": 172267,
      "sha256_raw": "933eb2e7cd297aeb24ed032c30ea94cea8b6f4ad7070d5c3053373401c1e5e6d",
      "sha256_normalized": "055dca783df4ef2844492f98dd3de908af520c0689b3667432adb0844a3e56c3",
      "normalizer": "html/v1",
      "extractor": null,
      "version_identity": {
        "kind": "normalized_hash",
        "value": "055dca783df4ef2844492f98dd3de908af520c0689b3667432adb0844a3e56c3"
      },
      "archive": {
        "status": "failed",
        "provider": "web.archive.org",
        "attempted": "2026-08-31T21:45:49Z",
        "note": "TimeoutError: The read operation timed out"
      }
    },
    {
      "source_id": "SRC-0032",
      "ref": "REF-002",
      "url": "https://therecord.media/russian-military-hackers-pose-as-recruiters-ukraine-it-workers",
      "format_family": "html",
      "preservation": "archive_only",
      "fetched": "2026-08-31T21:46:15Z",
      "http_status": 200,
      "content_type": "text/html",
      "content_length": 83004,
      "sha256_raw": "c606c2f5d766e42f08f1db7a19721c9dfef153b8e1db902b83ff92c53cfeefb1",
      "sha256_normalized": "5ecc3650c2f1b8dabb511ff039504f3f83cb7f7b73855fb2bf74c8e63333aa96",
      "normalizer": "html/v1",
      "extractor": null,
      "version_identity": {
        "kind": "normalized_hash",
        "value": "5ecc3650c2f1b8dabb511ff039504f3f83cb7f7b73855fb2bf74c8e63333aa96"
      },
      "archive": {
        "status": "captured",
        "provider": "web.archive.org",
        "url": "https://web.archive.org/web/20260831214630/https://therecord.media/russian-military-hackers-pose-as-recruiters-ukraine-it-workers",
        "attempted": "2026-08-31T21:46:17Z"
      }
    },
    {
      "source_id": "SRC-0060",
      "ref": "REF-003",
      "url": "https://www.microsoft.com/en-us/security/blog/2026/07/31/captivecrunch-midnight-blizzard-targets-travelers-worldwide-for-malware-delivery-and-credential-theft/",
      "format_family": "html",
      "preservation": "archive_only",
      "fetched": "2026-08-31T21:46:46Z",
      "http_status": 200,
      "content_type": "text/html",
      "content_length": 349455,
      "sha256_raw": "4cd0e5c102a080ce1885557a0a7245eea6b23858be753da20b0af9f18a6dff4f",
      "sha256_normalized": "f571563f145383cbed44bcd2ccaab129f032fd92348103a951c504b8eac9fa5b",
      "normalizer": "html/v1",
      "extractor": null,
      "version_identity": {
        "kind": "normalized_hash",
        "value": "f571563f145383cbed44bcd2ccaab129f032fd92348103a951c504b8eac9fa5b"
      },
      "archive": {
        "status": "captured",
        "provider": "web.archive.org",
        "url": "https://web.archive.org/web/20260831214651/https://www.microsoft.com/en-us/security/blog/2026/07/31/captivecrunch-midnight-blizzard-targets-travelers-worldwide-for-malware-delivery-and-credential-theft/",
        "attempted": "2026-08-31T21:46:48Z"
      }
    },
    {
      "source_id": "SRC-0061",
      "ref": "REF-004",
      "url": "https://reliaquest.com/blog/threat-spotlight-dns-poisoning-tactics-expand-to-hospitality/",
      "format_family": "html",
      "preservation": "archive_only",
      "fetched": "2026-08-31T21:47:09Z",
      "http_status": 200,
      "content_type": "text/html",
      "content_length": 83514,
      "sha256_raw": "07998349f905fb4917e103fb9039575f4d4fa41390c56c85adf6ee01e0c574d2",
      "sha256_normalized": "883f2f62d70e0aa78a4e1937f1edf2a368a61144f6859903456c4ade082f8823",
      "normalizer": "html/v1",
      "extractor": null,
      "version_identity": {
        "kind": "normalized_hash",
        "value": "883f2f62d70e0aa78a4e1937f1edf2a368a61144f6859903456c4ade082f8823"
      },
      "archive": {
        "status": "captured",
        "provider": "web.archive.org",
        "url": "https://web.archive.org/web/20260831214718/https://reliaquest.com/blog/threat-spotlight-dns-poisoning-tactics-expand-to-hospitality/",
        "attempted": "2026-08-31T21:47:11Z"
      }
    }
  ],
  "manifest_sha256": "67b13ef44ac27bd2d37f4438e971e5fe6c2769ea245519ec6da691ab75680254",
  "timestamp": {
    "status": "not_yet_anchored"
  }
}
