{
  "schema_version": 1,
  "serial": "TI-20260830-001",
  "generated": "2026-08-31T21:51:25Z",
  "capture_is_retrospective": true,
  "entries": [
    {
      "source_id": "SRC-0010",
      "ref": "REF-001",
      "url": "https://www.bleepingcomputer.com/news/security/ransomware-gang-abuses-microsoft-teams-relays-to-hide-malicious-traffic/",
      "format_family": "html",
      "preservation": "none",
      "fetched": "2026-08-31T21:47:33Z",
      "http_status": 200,
      "content_type": "text/html",
      "content_length": 89999,
      "sha256_raw": "888e273cf2d3130c0bb0182d5ea04c017872518791b09f77d4b94cf114251bfe",
      "sha256_normalized": "920504bb3c87669fdcc554f6690a5c8b61afe3620c46f9cafe4de5ffa006a6ef",
      "normalizer": "html/v1",
      "extractor": null,
      "version_identity": {
        "kind": "normalized_hash",
        "value": "920504bb3c87669fdcc554f6690a5c8b61afe3620c46f9cafe4de5ffa006a6ef"
      },
      "archive": {
        "status": "failed",
        "provider": "web.archive.org",
        "attempted": "2026-08-31T21:47:35Z",
        "note": "TimeoutError: The read operation timed out"
      }
    },
    {
      "source_id": "SRC-0010",
      "ref": "REF-002",
      "url": "https://www.bleepingcomputer.com/news/security/fake-it-support-calls-on-microsoft-teams-push-etherrat-malware/",
      "format_family": "html",
      "preservation": "archive_only",
      "fetched": "2026-08-31T21:48:02Z",
      "http_status": 200,
      "content_type": "text/html",
      "content_length": 90679,
      "sha256_raw": "7cd7e2f624881594cdafe772ddf59c64c7c1366832248fbb4a6037a209487af1",
      "sha256_normalized": "3804648b504b4b45f052164ecb5b34acdcdb34a27115d3944e3d4b4654a352f1",
      "normalizer": "html/v1",
      "extractor": null,
      "version_identity": {
        "kind": "normalized_hash",
        "value": "3804648b504b4b45f052164ecb5b34acdcdb34a27115d3944e3d4b4654a352f1"
      },
      "archive": {
        "status": "captured",
        "provider": "web.archive.org",
        "url": "https://web.archive.org/web/20260831214808/https://www.bleepingcomputer.com/news/security/fake-it-support-calls-on-microsoft-teams-push-etherrat-malware/",
        "attempted": "2026-08-31T21:48:04Z"
      }
    },
    {
      "source_id": "SRC-0010",
      "ref": "REF-003",
      "url": "https://www.bleepingcomputer.com/news/security/microsoft-teams-vishing-attacks-lead-to-chaos-ransomware-attacks/",
      "format_family": "html",
      "preservation": "archive_only",
      "fetched": "2026-08-31T21:48:31Z",
      "http_status": 200,
      "content_type": "text/html",
      "content_length": 93071,
      "sha256_raw": "65230024430300d82d154412e8d2bebe9aafc5bc10c44be2b1f78a7cf379c627",
      "sha256_normalized": "c49d5f776ff8edf578f4e381d555a29ab02c5df52d887a463bdde90c7f59e90b",
      "normalizer": "html/v1",
      "extractor": null,
      "version_identity": {
        "kind": "normalized_hash",
        "value": "c49d5f776ff8edf578f4e381d555a29ab02c5df52d887a463bdde90c7f59e90b"
      },
      "archive": {
        "status": "captured",
        "provider": "web.archive.org",
        "url": "https://web.archive.org/web/20260831214837/https://www.bleepingcomputer.com/news/security/microsoft-teams-vishing-attacks-lead-to-chaos-ransomware-attacks/",
        "attempted": "2026-08-31T21:48:33Z"
      }
    },
    {
      "source_id": "SRC-0060",
      "ref": "REF-004",
      "url": "https://www.microsoft.com/en-us/security/blog/2024/05/15/threat-actors-misusing-quick-assist-in-social-engineering-attacks-leading-to-ransomware/",
      "format_family": "html",
      "preservation": "archive_only",
      "fetched": "2026-08-31T21:49:03Z",
      "http_status": 200,
      "content_type": "text/html",
      "content_length": 314011,
      "sha256_raw": "d32f920cf5e7965140029074527c09019c4a4375da20631791697d92f6d5c7f4",
      "sha256_normalized": "e1048fd7ac0b0d8ce6bb3034dad108623624d200ab2003a97286742756a93d76",
      "normalizer": "html/v1",
      "extractor": null,
      "version_identity": {
        "kind": "normalized_hash",
        "value": "e1048fd7ac0b0d8ce6bb3034dad108623624d200ab2003a97286742756a93d76"
      },
      "archive": {
        "status": "captured",
        "provider": "web.archive.org",
        "url": "https://web.archive.org/web/20260831214909/https://www.microsoft.com/en-us/security/blog/2024/05/15/threat-actors-misusing-quick-assist-in-social-engineering-attacks-leading-to-ransomware/",
        "attempted": "2026-08-31T21:49:05Z"
      }
    },
    {
      "source_id": "SRC-0062",
      "ref": "REF-005",
      "url": "https://www.rapid7.com/blog/post/tr-muddying-tracks-state-sponsored-shadow-behind-chaos-ransomware/",
      "format_family": "html",
      "preservation": "none",
      "fetched": "2026-08-31T21:49:28Z",
      "http_status": 200,
      "content_type": "text/html",
      "content_length": 695836,
      "sha256_raw": "c3e56920c3d9cf56a864880e7996cde62a400e58a074afe687eb161873e4774b",
      "sha256_normalized": "b29bc26401c928505284f2ff7aaa03cc3bdbdd4ecd6b8b5e6af6027dd7c45884",
      "normalizer": "html/v1",
      "extractor": null,
      "version_identity": {
        "kind": "normalized_hash",
        "value": "b29bc26401c928505284f2ff7aaa03cc3bdbdd4ecd6b8b5e6af6027dd7c45884"
      },
      "archive": {
        "status": "failed",
        "provider": "web.archive.org",
        "attempted": "2026-08-31T21:49:30Z",
        "note": "TimeoutError: The read operation timed out"
      }
    },
    {
      "source_id": "SRC-0018",
      "ref": "REF-006",
      "url": "https://www.securityweek.com/iranian-apt-intrusion-masquerades-as-chaos-ransomware-attack/",
      "format_family": "html",
      "preservation": "archive_only",
      "fetched": "2026-08-31T21:49:57Z",
      "http_status": 200,
      "content_type": "text/html",
      "content_length": 160505,
      "sha256_raw": "5a3671989df94c7283e6d09f83c50119b0acab0cf5daf66fa5138cccb1549d11",
      "sha256_normalized": "005889fd54e5a07da5f05d45c341afca79b2a07eb56cb49109b437332c414f26",
      "normalizer": "html/v1",
      "extractor": null,
      "version_identity": {
        "kind": "normalized_hash",
        "value": "005889fd54e5a07da5f05d45c341afca79b2a07eb56cb49109b437332c414f26"
      },
      "archive": {
        "status": "captured",
        "provider": "web.archive.org",
        "url": "https://web.archive.org/web/20260831215006/https://www.securityweek.com/iranian-apt-intrusion-masquerades-as-chaos-ransomware-attack/",
        "attempted": "2026-08-31T21:49:59Z"
      }
    },
    {
      "source_id": "SRC-0063",
      "ref": "REF-007",
      "url": "https://www.sophos.com/en-us/blog/chaos-in-teams-vishing",
      "format_family": "html",
      "preservation": "archive_only",
      "fetched": "2026-08-31T21:50:29Z",
      "http_status": 200,
      "content_type": "text/html",
      "content_length": 705408,
      "sha256_raw": "2e0c864022a809161528f5f78381ec411af2ebb95f1769ab1d7921cd42ef27eb",
      "sha256_normalized": "4daa058f288aed4284e65193afa945b3080d5d725118d185c84b80552ad2ffef",
      "normalizer": "html/v1",
      "extractor": null,
      "version_identity": {
        "kind": "normalized_hash",
        "value": "4daa058f288aed4284e65193afa945b3080d5d725118d185c84b80552ad2ffef"
      },
      "archive": {
        "status": "captured",
        "provider": "web.archive.org",
        "url": "https://web.archive.org/web/20260831215034/https://www.sophos.com/en-us/blog/chaos-in-teams-vishing",
        "attempted": "2026-08-31T21:50:31Z"
      }
    },
    {
      "source_id": "SRC-0019",
      "ref": "REF-008",
      "url": "https://thehackernews.com/2026/05/muddywater-uses-microsoft-teams-to.html",
      "format_family": "html",
      "preservation": "none",
      "fetched": "2026-08-31T21:50:57Z",
      "http_status": 200,
      "content_type": "text/html",
      "content_length": 179587,
      "sha256_raw": "5b0a7e54cdd17b7846d76094dc54440df3bdd38c3bee9a1e5dfe14ecc95edee0",
      "sha256_normalized": "19bafd648691337ab21d02391ddc38883833a9be51fe28a399002e3c4a6c5b56",
      "normalizer": "html/v1",
      "extractor": null,
      "version_identity": {
        "kind": "normalized_hash",
        "value": "19bafd648691337ab21d02391ddc38883833a9be51fe28a399002e3c4a6c5b56"
      },
      "archive": {
        "status": "failed",
        "provider": "web.archive.org",
        "attempted": "2026-08-31T21:50:59Z",
        "note": "TimeoutError: The read operation timed out"
      }
    }
  ],
  "manifest_sha256": "00608304f7700c5993346266961383c492a659fa41d3793d9f9d1347eac66570",
  "timestamp": {
    "status": "not_yet_anchored"
  }
}
